job_role,company_name,company_type,knowledge,skills,knowledge_cleaned,skills_cleaned,combined_features
Software Engineer,Capgemini,GSI,"CI/CD pipeline setup, GitHub, Git commands, webhook management, Linux, Jenkins, SonarQube, repository migration (Bitbucket to GitHub), Groovy, PowerShell, Artifact tools (Nexus3, NexusIQ), Docker, source code management (GitHub/Bitbucket), infrastructure documentation, deployment processes, resource estimation, SQL-based database solutions (SQL Server, PostgreSQL), backup and disaster recovery strategies.","Experience with setting up and managing CI/CD pipelines using GitHub, managing webhooks and Git commands, basic knowledge of Linux, Jenkins, and SonarQube, repository migration from Bitbucket to GitHub, scripting with Groovy and PowerShell, troubleshooting application, infrastructure, and deployment pipeline issues, using Artifact tools (Nexus3, NexusIQ), Docker containerization, source code management with GitHub and Bitbucket, creating and maintaining infrastructure and deployment documentation, estimating resource requirements for performance and scalability, working with SQL-based databases (SQL Server, PostgreSQL), implementing backup and disaster recovery plans, and excellent oral and written communication skills.",cicd pipeline setup github git commands webhook management linux jenkins sonarqube repository migration bitbucket github groovy powershell artifact tools nexus3 nexusiq docker source code management githubbitbucket infrastructure documentation deployment processes resource estimation sqlbased database solutions sql server postgresql backup disaster recovery strategies,experience setting managing cicd pipelines using github managing webhooks git commands basic knowledge linux jenkins sonarqube repository migration bitbucket github scripting groovy powershell troubleshooting application infrastructure deployment pipeline issues using artifact tools nexus3 nexusiq docker containerization source code management github bitbucket creating maintaining infrastructure deployment documentation estimating resource requirements performance scalability working sqlbased databases sql server postgresql implementing backup disaster recovery plans excellent oral written communication skills,Software Engineer GSI cicd pipeline setup github git commands webhook management linux jenkins sonarqube repository migration bitbucket github groovy powershell artifact tools nexus3 nexusiq docker source code management githubbitbucket infrastructure documentation deployment processes resource estimation sqlbased database solutions sql server postgresql backup disaster recovery strategies experience setting managing cicd pipelines using github managing webhooks git commands basic knowledge linux jenkins sonarqube repository migration bitbucket github scripting groovy powershell troubleshooting application infrastructure deployment pipeline issues using artifact tools nexus3 nexusiq docker containerization source code management github bitbucket creating maintaining infrastructure deployment documentation estimating resource requirements performance scalability working sqlbased databases sql server postgresql implementing backup disaster recovery plans excellent oral written communication skills
Software Engineer,Capgemini,GSI,"Cards/Payment domain, Core Java, Spring Framework (Spring Boot, Spring Batch), RESTful API services, Unix Shell scripting, relational databases, SQL, cloud platforms (AWS, Azure, Google Cloud, Oracle), Java EE applications, CI/CD pipelines, Java application development, high-availability applications, software analysis and error checking, integration and deployment processes","Strong experience in Java development, expertise in Core Java, Spring Framework (Spring Boot, Spring Batch), RESTful API services, writing test cases and Unix Shell scripts, proficient with relational databases and SQL, problem-solving abilities, experience with cloud platforms (AWS, Azure, Google Cloud, Oracle), hands-on Java and Java EE applications, implementation of CI/CD pipelines, planning, developing, and maintaining Java applications, efficient and error-free coding, collaboration on projects, integration and deployment of updates, creating high-availability applications, software analysis and error checking, and excellent communication, organizational, and teamwork skills.",cardspayment domain core java spring framework spring boot spring batch restful api services unix shell scripting relational databases sql cloud platforms aws azure google cloud oracle java ee applications cicd pipelines java application development highavailability applications software analysis error checking integration deployment processes,strong experience java development expertise core java spring framework spring boot spring batch restful api services writing test cases unix shell scripts proficient relational databases sql problemsolving abilities experience cloud platforms aws azure google cloud oracle handson java java ee applications implementation cicd pipelines planning developing maintaining java applications efficient errorfree coding collaboration projects integration deployment updates creating highavailability applications software analysis error checking excellent communication organizational teamwork skills,Software Engineer GSI cardspayment domain core java spring framework spring boot spring batch restful api services unix shell scripting relational databases sql cloud platforms aws azure google cloud oracle java ee applications cicd pipelines java application development highavailability applications software analysis error checking integration deployment processes strong experience java development expertise core java spring framework spring boot spring batch restful api services writing test cases unix shell scripts proficient relational databases sql problemsolving abilities experience cloud platforms aws azure google cloud oracle handson java java ee applications implementation cicd pipelines planning developing maintaining java applications efficient errorfree coding collaboration projects integration deployment updates creating highavailability applications software analysis error checking excellent communication organizational teamwork skills
Software Engineer - B,Capgemini,GSI,"C, C++, Linux, Shell scripting, Linux internals (IPC mechanisms, threads, socket programming), data structures and algorithms, enterprise application development, operating system concepts, multi-threaded programming, socket programming, REST API implementation, debugging tools (dbx, kdb, gdb).","Strong programming skills in C, C++, Linux and Shell scripting, expertise in Linux internals (IPC, threads, socket programming), deep knowledge of operating system concepts and multi-threaded programming, experience with REST API implementation, advanced debugging skills using tools like dbx, kdb, and gdb, and ability to develop robust enterprise applications.",c c linux shell scripting linux internals ipc mechanisms threads socket programming data structures algorithms enterprise application development operating system concepts multithreaded programming socket programming rest api implementation debugging tools dbx kdb gdb,strong programming skills c c linux shell scripting expertise linux internals ipc threads socket programming deep knowledge operating system concepts multithreaded programming experience rest api implementation advanced debugging skills using tools like dbx kdb gdb ability develop robust enterprise applications,Software Engineer - B GSI c c linux shell scripting linux internals ipc mechanisms threads socket programming data structures algorithms enterprise application development operating system concepts multithreaded programming socket programming rest api implementation debugging tools dbx kdb gdb strong programming skills c c linux shell scripting expertise linux internals ipc threads socket programming deep knowledge operating system concepts multithreaded programming experience rest api implementation advanced debugging skills using tools like dbx kdb gdb ability develop robust enterprise applications
Web Application Development - .NET Fullstack with Angular or React JS,Deloitte,GSI,"Microservices implementation, containerized environments, .NET Core, C#, Web API, Angular 2+, React JS, JavaScript, jQuery, GitLab, CI/CD, HTML, CSS, Test-Driven Development (TDD), Agile development methodologies, Jira, GitHub, Jenkins, Collaborator, design patterns, unit testing, debugging, triaging, performance tuning, troubleshooting, software systems, development in fast-paced environments.","Experience in implementing microservices in containerized environments, strong web development skills with .NET Core, C#, Web API, Angular 2+, React JS, JavaScript, jQuery, GitLab, CI/CD, HTML, CSS, proficiency in Test-Driven Development (TDD), Agile development (Jira, GitHub, Jenkins, Collaborator), understanding of common design patterns and unit testing, excellent debugging, triaging, and performance tuning abilities, troubleshooting large software systems, ability to work effectively both individually and as part of a team in fast-paced environments, and exceptional written and verbal communication skills in English",microservices implementation containerized environments net core c web api angular 2 react js javascript jquery gitlab cicd html css testdriven development tdd agile development methodologies jira github jenkins collaborator design patterns unit testing debugging triaging performance tuning troubleshooting software systems development fastpaced environments,experience implementing microservices containerized environments strong web development skills net core c web api angular 2 react js javascript jquery gitlab cicd html css proficiency testdriven development tdd agile development jira github jenkins collaborator understanding common design patterns unit testing excellent debugging triaging performance tuning abilities troubleshooting large software systems ability work effectively individually part team fastpaced environments exceptional written verbal communication skills english,Web Application Development - .NET Fullstack with Angular or React JS GSI microservices implementation containerized environments net core c web api angular 2 react js javascript jquery gitlab cicd html css testdriven development tdd agile development methodologies jira github jenkins collaborator design patterns unit testing debugging triaging performance tuning troubleshooting software systems development fastpaced environments experience implementing microservices containerized environments strong web development skills net core c web api angular 2 react js javascript jquery gitlab cicd html css proficiency testdriven development tdd agile development jira github jenkins collaborator understanding common design patterns unit testing excellent debugging triaging performance tuning abilities troubleshooting large software systems ability work effectively individually part team fastpaced environments exceptional written verbal communication skills english
DET-Senior Software Engineer,Ernst & Young (EY),GSI,"Java software development (Java 8+), JVM, SQL and NoSQL databases, data structures, concurrency, Maven, Git, IDEs, distributed systems, UNIX systems, Cloud Computing (AWS, GCP, Azure), Docker, system testing, unit testing, release and deployment management, Agile Project Management, SAFE, Scrum concepts, Agile certification (plus).","Strong experience in Java software development (Java 8+), hands-on experience with SQL and NoSQL databases, expertise in data structures and concurrency, proficient with development tools like Maven, Git, and IDEs, experience with distributed systems and UNIX systems, familiarity with Cloud Computing (AWS, GCP, or Azure), cross-platform integration, system testing, and unit testing, knowledge of release and deployment management processes, Docker containerization, and extensive experience in delivering large programs/projects using Agile methodologies (SAFE, Scrum), with Agile certification being a plus.",java software development java 8 jvm sql nosql databases data structures concurrency maven git ides distributed systems unix systems cloud computing aws gcp azure docker system testing unit testing release deployment management agile project management safe scrum concepts agile certification plus,strong experience java software development java 8 handson experience sql nosql databases expertise data structures concurrency proficient development tools like maven git ides experience distributed systems unix systems familiarity cloud computing aws gcp azure crossplatform integration system testing unit testing knowledge release deployment management processes docker containerization extensive experience delivering large programsprojects using agile methodologies safe scrum agile certification plus,DET-Senior Software Engineer GSI java software development java 8 jvm sql nosql databases data structures concurrency maven git ides distributed systems unix systems cloud computing aws gcp azure docker system testing unit testing release deployment management agile project management safe scrum concepts agile certification plus strong experience java software development java 8 handson experience sql nosql databases expertise data structures concurrency proficient development tools like maven git ides experience distributed systems unix systems familiarity cloud computing aws gcp azure crossplatform integration system testing unit testing knowledge release deployment management processes docker containerization extensive experience delivering large programsprojects using agile methodologies safe scrum agile certification plus
TechOps-DE-CloudOpsAMS-JAVA FULLSTACK-Senior,Ernst & Young (EY),GSI,"Java, J2EE, Java 8, RESTful Web Services, Spring Boot, Angular/React, Cloud platforms (Azure, AWS), DevOps tools (GIT, Jenkins), Oracle, MS-SQL Server, SQL, architecture styles/APIs (REST, RPC), software development best practices, on-call support.","Proven experience in Java development (Java, J2EE, Java 8), building and deploying RESTful Web Services, hands-on experience with Spring Boot, front-end frameworks like Angular/React, cloud platforms (Azure, AWS), and DevOps tools (GIT, Jenkins). Solid SQL skills with experience in Oracle and MS-SQL Server, understanding of architecture styles and APIs (REST, RPC), troubleshooting and communication skills, attention to detail, knowledge of software development best practices, excellent business communication skills, and ability to work in shifts with on-call support.",java j2ee java 8 restful web services spring boot angularreact cloud platforms azure aws devops tools git jenkins oracle mssql server sql architecture stylesapis rest rpc software development best practices oncall support,proven experience java development java j2ee java 8 building deploying restful web services handson experience spring boot frontend frameworks like angularreact cloud platforms azure aws devops tools git jenkins solid sql skills experience oracle mssql server understanding architecture styles apis rest rpc troubleshooting communication skills attention detail knowledge software development best practices excellent business communication skills ability work shifts oncall support,TechOps-DE-CloudOpsAMS-JAVA FULLSTACK-Senior GSI java j2ee java 8 restful web services spring boot angularreact cloud platforms azure aws devops tools git jenkins oracle mssql server sql architecture stylesapis rest rpc software development best practices oncall support proven experience java development java j2ee java 8 building deploying restful web services handson experience spring boot frontend frameworks like angularreact cloud platforms azure aws devops tools git jenkins solid sql skills experience oracle mssql server understanding architecture styles apis rest rpc troubleshooting communication skills attention detail knowledge software development best practices excellent business communication skills ability work shifts oncall support
Software Engineering - Application Developer - 11,Accenture,GSI,"HTML, CSS, JavaScript, JavaScript frameworks (React, Angular, Vue), JavaScript libraries (jQuery, Bootstrap), HTML5, semantic HTML5 elements, cross-browser compatibility, responsive web design.","Experience in developing modern, responsive, and cross-browser-compatible websites, proficiency in HTML, CSS, and JavaScript, expertise with JavaScript frameworks (React, Angular, Vue), working knowledge of JavaScript libraries (jQuery, Bootstrap), strong understanding of HTML5, including semantic HTML5 elements, and ensuring cross-browser compatibility for web applications.",html css javascript javascript frameworks react angular vue javascript libraries jquery bootstrap html5 semantic html5 elements crossbrowser compatibility responsive web design,experience developing modern responsive crossbrowsercompatible websites proficiency html css javascript expertise javascript frameworks react angular vue working knowledge javascript libraries jquery bootstrap strong understanding html5 including semantic html5 elements ensuring crossbrowser compatibility web applications,Software Engineering - Application Developer - 11 GSI html css javascript javascript frameworks react angular vue javascript libraries jquery bootstrap html5 semantic html5 elements crossbrowser compatibility responsive web design experience developing modern responsive crossbrowsercompatible websites proficiency html css javascript expertise javascript frameworks react angular vue working knowledge javascript libraries jquery bootstrap strong understanding html5 including semantic html5 elements ensuring crossbrowser compatibility web applications
Software Engineering - Test Automation Engineer - 11,Accenture,GSI,"Aviation background (preferred), End-to-End Automation Testing, UI Testing, Performance Testing, API Testing, Test Automation tools (Selenium, Selenium WebDriver, Cucumber, Jenkins), AWS.","Expertise in End-to-End Automation Testing, UI Testing, Performance Testing, and API Testing, proficiency with Test Automation tools like Selenium, Selenium WebDriver, Cucumber, and Jenkins pipeline, familiarity with AWS, and willingness to learn and adapt, especially in an aviation context.",aviation background preferred endtoend automation testing ui testing performance testing api testing test automation tools selenium selenium webdriver cucumber jenkins aws,expertise endtoend automation testing ui testing performance testing api testing proficiency test automation tools like selenium selenium webdriver cucumber jenkins pipeline familiarity aws willingness learn adapt especially aviation context,Software Engineering - Test Automation Engineer - 11 GSI aviation background preferred endtoend automation testing ui testing performance testing api testing test automation tools selenium selenium webdriver cucumber jenkins aws expertise endtoend automation testing ui testing performance testing api testing proficiency test automation tools like selenium selenium webdriver cucumber jenkins pipeline familiarity aws willingness learn adapt especially aviation context
Software Engineering - Application Developer - 11,Accenture,GSI,"React.js, React 16.0, React Hooks, Redux, Flux, Webpack, JavaScript ES6, data management (React components, parent-child, sibling components), AWS (S3, RDS, Cognito, Lambda), cloud infrastructure management, Python (willingness to learn), web interface design (Sigma, Git, CSS, Adobe XD).","Proficient in React 16.0 and React Hooks, hands-on experience with JavaScript ES6, data management between React components (parent-child, sibling components), experience in creating user interfaces using React tools, converting design mockups into code, working with libraries and tools such as Sigma, Git, CSS, Adobe XD, front-end performance profiling, and improvement. Skilled in cloud infrastructure setup and maintenance (AWS, S3, RDS, Cognito, Lambda), and a readiness to learn Python.",reactjs react 160 react hooks redux flux webpack javascript es6 data management react components parentchild sibling components aws s3 rds cognito lambda cloud infrastructure management python willingness learn web interface design sigma git css adobe xd,proficient react 160 react hooks handson experience javascript es6 data management react components parentchild sibling components experience creating user interfaces using react tools converting design mockups code working libraries tools sigma git css adobe xd frontend performance profiling improvement skilled cloud infrastructure setup maintenance aws s3 rds cognito lambda readiness learn python,Software Engineering - Application Developer - 11 GSI reactjs react 160 react hooks redux flux webpack javascript es6 data management react components parentchild sibling components aws s3 rds cognito lambda cloud infrastructure management python willingness learn web interface design sigma git css adobe xd proficient react 160 react hooks handson experience javascript es6 data management react components parentchild sibling components experience creating user interfaces using react tools converting design mockups code working libraries tools sigma git css adobe xd frontend performance profiling improvement skilled cloud infrastructure setup maintenance aws s3 rds cognito lambda readiness learn python
AIML Engineer - GENAI,LTI-Mindtree,Service,"Generative AI, AIML, RAG methodologies, vector databases, document chunking, cloud AI services (AWS, Azure), Python, Flask, FastAPI, deep learning, NLP, machine learning algorithms (GPT, CNN, RNN, etc.), MLOps, cloud platforms (AWS, GCP, Azure).","Experience in Generative AI and AIML, implementing end-to-end AI projects, designing AI/ML solutions, working with RAG, vector databases, and cloud AI services. Proficient in Python, deep learning, TensorFlow, NLP, and machine learning algorithms. Experience in automating RAG pipelines and setting up monitoring and observability for AI solutions. Familiar with MLOps and cloud platforms (AWS, Azure, GCP).",generative ai aiml rag methodologies vector databases document chunking cloud ai services aws azure python flask fastapi deep learning nlp machine learning algorithms gpt cnn rnn etc mlops cloud platforms aws gcp azure,experience generative ai aiml implementing endtoend ai projects designing aiml solutions working rag vector databases cloud ai services proficient python deep learning tensorflow nlp machine learning algorithms experience automating rag pipelines setting monitoring observability ai solutions familiar mlops cloud platforms aws azure gcp,AIML Engineer - GENAI Service generative ai aiml rag methodologies vector databases document chunking cloud ai services aws azure python flask fastapi deep learning nlp machine learning algorithms gpt cnn rnn etc mlops cloud platforms aws gcp azure experience generative ai aiml implementing endtoend ai projects designing aiml solutions working rag vector databases cloud ai services proficient python deep learning tensorflow nlp machine learning algorithms experience automating rag pipelines setting monitoring observability ai solutions familiar mlops cloud platforms aws azure gcp
Software Engineering,LTI-Mindtree,Service,"Spring Boot, Java (Java 7, 8), Spring Core, Spring MVC, Swagger, Tomcat 8, Maven, Jenkins, SVN, GIT, Postman, Newman, RESTful Services, Microservices, NodeJS, Spring Integration, Spring Data, Containers.","Proficient in Java (Java 7, 8), Spring Framework (Spring Boot, Spring Core, Spring MVC, Spring Integration, Spring Data), RESTful services, Swagger, and Microservices. Hands-on experience with Tomcat 8, Maven, Jenkins, SVN, GIT, Postman, Newman, Mountebank, and NodeJS. Strong written and verbal communication skills, with a solid understanding of modern Spring platform capabilities.",spring boot java java 7 8 spring core spring mvc swagger tomcat 8 maven jenkins svn git postman newman restful services microservices nodejs spring integration spring data containers,proficient java java 7 8 spring framework spring boot spring core spring mvc spring integration spring data restful services swagger microservices handson experience tomcat 8 maven jenkins svn git postman newman mountebank nodejs strong written verbal communication skills solid understanding modern spring platform capabilities,Software Engineering Service spring boot java java 7 8 spring core spring mvc swagger tomcat 8 maven jenkins svn git postman newman restful services microservices nodejs spring integration spring data containers proficient java java 7 8 spring framework spring boot spring core spring mvc spring integration spring data restful services swagger microservices handson experience tomcat 8 maven jenkins svn git postman newman mountebank nodejs strong written verbal communication skills solid understanding modern spring platform capabilities
