job_role,company_name,company_type,knowledge,skills,knowledge_cleaned,skills_cleaned,combined_features
Data Engineer II A - GBS IND,Bank of America,GCC,"Big Data domain, Hadoop stack technologies (HDFS, Spark, Yarn, Hive, Sqoop, Impala, Hue), NoSQL technologies (HBase, MongoDB, SingleStore), Real-time streaming technologies (Spark Streaming, Kafka, Flink, Storm), Cloud technologies (Azure, AWS, GCP), Machine learning algorithms, Data integration, Data security, Kerberos.","Python, Scala, Bash/Shell scripting, Visual analytics tools (Tableau), Data analysis, Statistical analysis, Data security, Predictive modeling, Problem-solving, Data integration, Cloud platform expertise, Machine learning programming (Python/R).",big data domain hadoop stack technologies hdfs spark yarn hive sqoop impala hue nosql technologies hbase mongodb singlestore realtime streaming technologies spark streaming kafka flink storm cloud technologies azure aws gcp machine learning algorithms data integration data security kerberos,python scala bashshell scripting visual analytics tools tableau data analysis statistical analysis data security predictive modeling problemsolving data integration cloud platform expertise machine learning programming pythonr,Data Engineer II A - GBS IND GCC big data domain hadoop stack technologies hdfs spark yarn hive sqoop impala hue nosql technologies hbase mongodb singlestore realtime streaming technologies spark streaming kafka flink storm cloud technologies azure aws gcp machine learning algorithms data integration data security kerberos python scala bashshell scripting visual analytics tools tableau data analysis statistical analysis data security predictive modeling problemsolving data integration cloud platform expertise machine learning programming pythonr
Data Engineer II A - GBS IND,Bank of America,GCC,"Quality assurance tools, methods, concepts, Continuous Monitoring Tool, SharePoint, regulatory standards, enterprise change policy, CVE (Common Vulnerabilities and Exposures), vulnerability data, SORs (System of Record), public vulnerability data, external vendors.","Technical and manual QA activities, data collection and analysis, communication (verbal/written), organizational skills, attention to detail, problem-solving, partnership and relationship building, Excel (VLOOKUP, pivot tables, macros), PowerPoint, SharePoint, investigative skills, results delivery in challenging situations.",quality assurance tools methods concepts continuous monitoring tool sharepoint regulatory standards enterprise change policy cve common vulnerabilities exposures vulnerability data sors system record public vulnerability data external vendors,technical manual qa activities data collection analysis communication verbalwritten organizational skills attention detail problemsolving partnership relationship building excel vlookup pivot tables macros powerpoint sharepoint investigative skills results delivery challenging situations,Data Engineer II A - GBS IND GCC quality assurance tools methods concepts continuous monitoring tool sharepoint regulatory standards enterprise change policy cve common vulnerabilities exposures vulnerability data sors system record public vulnerability data external vendors technical manual qa activities data collection analysis communication verbalwritten organizational skills attention detail problemsolving partnership relationship building excel vlookup pivot tables macros powerpoint sharepoint investigative skills results delivery challenging situations
Business Analyst,Shell,GCC,"Physical commodities trading markets (LNG, Gas, Oil, Power), ETRM market, Nominations, Settlements, Accounting, AGILE project delivery, Business analysis techniques, Solution feasibility and risk assessment, Business case development, Trader models, Geographically distributed teams.","IT experience, Business problem capturing, Requirements gathering (functional/non-functional), Solution translation, Problem-solving, Complex concept articulation, Task delivery focus, Cost-benefit analysis, Stakeholder management, Cross-functional teamwork, Communication (verbal & written), Time management.",physical commodities trading markets lng gas oil power etrm market nominations settlements accounting agile project delivery business analysis techniques solution feasibility risk assessment business case development trader models geographically distributed teams,experience business problem capturing requirements gathering functionalnonfunctional solution translation problemsolving complex concept articulation task delivery focus costbenefit analysis stakeholder management crossfunctional teamwork communication verbal written time management,Business Analyst GCC physical commodities trading markets lng gas oil power etrm market nominations settlements accounting agile project delivery business analysis techniques solution feasibility risk assessment business case development trader models geographically distributed teams experience business problem capturing requirements gathering functionalnonfunctional solution translation problemsolving complex concept articulation task delivery focus costbenefit analysis stakeholder management crossfunctional teamwork communication verbal written time management
Digitalization Specialist,Shell,GCC,"DIY digitalization solutions, Plant/Industry experience, GEN AI technologies, Machine learning algorithms, Data pre-processing, Natural Language Processing (NLP), Large Language Models (GPT, BERT), Data integration, Real-time data processing, Data analytics, S4 Hana integration, Data visualization, Predictive analytics, Digitalization trends, AI technologies.","IT consulting, Data manipulation (Python, R, SQL), Machine learning application, Data visualization techniques, Project management, Stakeholder collaboration, Communication (verbal & written), Cross-functional teamwork, Continuous learning, Time management, Multi-tasking, Problem-solving.",diy digitalization solutions plantindustry experience gen ai technologies machine learning algorithms data preprocessing natural language processing nlp large language models gpt bert data integration realtime data processing data analytics s4 hana integration data visualization predictive analytics digitalization trends ai technologies,consulting data manipulation python r sql machine learning application data visualization techniques project management stakeholder collaboration communication verbal written crossfunctional teamwork continuous learning time management multitasking problemsolving,Digitalization Specialist GCC diy digitalization solutions plantindustry experience gen ai technologies machine learning algorithms data preprocessing natural language processing nlp large language models gpt bert data integration realtime data processing data analytics s4 hana integration data visualization predictive analytics digitalization trends ai technologies consulting data manipulation python r sql machine learning application data visualization techniques project management stakeholder collaboration communication verbal written crossfunctional teamwork continuous learning time management multitasking problemsolving
Label Analyst,Shell,GCC,"Project management methodologies, Stakeholder management, Process/system implementation, Cross-cultural and virtual collaboration.","Organization, Accountability, Attention to detail, Leadership, Influence, Communication (verbal & written), Advanced computer skills (Word, Excel, PowerPoint, GSAP), Cross-functional teamwork, Problem-solving, Time management.",project management methodologies stakeholder management processsystem implementation crosscultural virtual collaboration,organization accountability attention detail leadership influence communication verbal written advanced computer skills word excel powerpoint gsap crossfunctional teamwork problemsolving time management,Label Analyst GCC project management methodologies stakeholder management processsystem implementation crosscultural virtual collaboration organization accountability attention detail leadership influence communication verbal written advanced computer skills word excel powerpoint gsap crossfunctional teamwork problemsolving time management
"Manager, Data Science - Visa Consulting and Analytics",Visa,GCC,"Data extraction, Machine learning (regression, clustering, classification), Analytical problem-solving, Business intelligence, Data modeling, Predictive analysis, Dashboard design, Statistical analysis, Operational research, Computer science fundamentals.","SQL, Hive, Spark, Python, Tableau, PowerPoint, Excel, Dashboard creation, Communication (verbal & written), Multitasking, Self-motivation, Time management, Data visualization, Problem-solving, Travel flexibility.",data extraction machine learning regression clustering classification analytical problemsolving business intelligence data modeling predictive analysis dashboard design statistical analysis operational research computer science fundamentals,sql hive spark python tableau powerpoint excel dashboard creation communication verbal written multitasking selfmotivation time management data visualization problemsolving travel flexibility,"Manager, Data Science - Visa Consulting and Analytics GCC data extraction machine learning regression clustering classification analytical problemsolving business intelligence data modeling predictive analysis dashboard design statistical analysis operational research computer science fundamentals sql hive spark python tableau powerpoint excel dashboard creation communication verbal written multitasking selfmotivation time management data visualization problemsolving travel flexibility"
Senior Manager Data Science - Visa Consulting & Analytics,Visa,GCC,"Data science, AI, Statistical modeling, Linear regression, Logistic regression, Clustering methods (K-means), Principal components analysis, Classification methods (decision trees, gradient boosting), Monte Carlo analysis, Natural language processing, Machine learning ecosystems (TensorFlow, Keras, Scikit-learn, PyTorch), Big data technologies (Python/PySpark, R, SQL, Hadoop/Hive, Presto, SAS), Retail banking, Payments, Financial services, Cloud platforms (AWS, Azure, GCP).","Data science consulting, Machine learning model development, Data extraction and manipulation, Project management, Organizational skills, Communication (verbal & written), Presentation skills, AI deployment, Data-driven decision-making, Problem-solving, Stakeholder collaboration",data science ai statistical modeling linear regression logistic regression clustering methods kmeans principal components analysis classification methods decision trees gradient boosting monte carlo analysis natural language processing machine learning ecosystems tensorflow keras scikitlearn pytorch big data technologies pythonpyspark r sql hadoophive presto sas retail banking payments financial services cloud platforms aws azure gcp,data science consulting machine learning model development data extraction manipulation project management organizational skills communication verbal written presentation skills ai deployment datadriven decisionmaking problemsolving stakeholder collaboration,Senior Manager Data Science - Visa Consulting & Analytics GCC data science ai statistical modeling linear regression logistic regression clustering methods kmeans principal components analysis classification methods decision trees gradient boosting monte carlo analysis natural language processing machine learning ecosystems tensorflow keras scikitlearn pytorch big data technologies pythonpyspark r sql hadoophive presto sas retail banking payments financial services cloud platforms aws azure gcp data science consulting machine learning model development data extraction manipulation project management organizational skills communication verbal written presentation skills ai deployment datadriven decisionmaking problemsolving stakeholder collaboration
"Sr. Manager, Data Science",Visa,GCC,"Deep learning, Machine learning, Data mining, Statistical analysis, Modeling techniques (logistic regression, Naïve Bayes, SVM, decision trees, neural networks), MLOps, Stream computing, Algorithms, Data structures, Data visualization, Business intelligence tools (Tableau, Power BI), Product development, Engineering processes.","Python, SQL, Analytical problem-solving, Data analytics, Communication (verbal & written), Presentation of complex ideas, Team collaboration, Product delivery, Time management, Interpersonal skills, Work ethics, Data-driven decision-making, Metrics evaluation, Cross-functional teamwork.",deep learning machine learning data mining statistical analysis modeling techniques logistic regression nave bayes svm decision trees neural networks mlops stream computing algorithms data structures data visualization business intelligence tools tableau power bi product development engineering processes,python sql analytical problemsolving data analytics communication verbal written presentation complex ideas team collaboration product delivery time management interpersonal skills work ethics datadriven decisionmaking metrics evaluation crossfunctional teamwork,"Sr. Manager, Data Science GCC deep learning machine learning data mining statistical analysis modeling techniques logistic regression nave bayes svm decision trees neural networks mlops stream computing algorithms data structures data visualization business intelligence tools tableau power bi product development engineering processes python sql analytical problemsolving data analytics communication verbal written presentation complex ideas team collaboration product delivery time management interpersonal skills work ethics datadriven decisionmaking metrics evaluation crossfunctional teamwork"
Analyst - Privacy & Data Protection,Infosys,GSI,"Coding, Software development, Security engineering, Security testing, Data privacy, General Data Protection Regulation (GDPR), Certified Information Privacy Technologist (CIPT), Certified Information Privacy Professional (CIPP), DSCI Certified Privacy Lead Assessor, Data privacy laws and regulations.","Software development, Security testing, Privacy consulting, Data privacy expertise, GDPR compliance, Privacy assessment, Regulatory knowledge, Cross-functional collaboration, Communication (verbal & written), Problem-solving.",coding software development security engineering security testing data privacy general data protection regulation gdpr certified information privacy technologist cipt certified information privacy professional cipp dsci certified privacy lead assessor data privacy laws regulations,software development security testing privacy consulting data privacy expertise gdpr compliance privacy assessment regulatory knowledge crossfunctional collaboration communication verbal written problemsolving,Analyst - Privacy & Data Protection GSI coding software development security engineering security testing data privacy general data protection regulation gdpr certified information privacy technologist cipt certified information privacy professional cipp dsci certified privacy lead assessor data privacy laws regulations software development security testing privacy consulting data privacy expertise gdpr compliance privacy assessment regulatory knowledge crossfunctional collaboration communication verbal written problemsolving
Data Specialist - (Infosys Knowledge Institute),Infosys,GSI,"Emerging technologies (AI, data, cloud, APIs, cyber), Thought leadership, Design thinking, Agile principles, Startup culture, Project-based environments, Primary and secondary research, Data analytics, Market trends, Storytelling.","Communication (written & oral), Content creation, Report writing, Presentation skills, Entrepreneurial mindset, Self-motivation, Research expertise, Analytical thinking, Problem-solving, Idea generation, Stakeholder engagement.",emerging technologies ai data cloud apis cyber thought leadership design thinking agile principles startup culture projectbased environments primary secondary research data analytics market trends storytelling,communication written oral content creation report writing presentation skills entrepreneurial mindset selfmotivation research expertise analytical thinking problemsolving idea generation stakeholder engagement,Data Specialist - (Infosys Knowledge Institute) GSI emerging technologies ai data cloud apis cyber thought leadership design thinking agile principles startup culture projectbased environments primary secondary research data analytics market trends storytelling communication written oral content creation report writing presentation skills entrepreneurial mindset selfmotivation research expertise analytical thinking problemsolving idea generation stakeholder engagement
Mongo/Postgres/DB2 Database Administrators,Infosys,GSI,"Big Data, NoSQL, MongoDB, DB2 on Mainframe, Database administration, PostgreSQL, DB2 administration, NoSQL database management.","MongoDB administration, DB2 administration (Mainframe), PostgreSQL administration, Database performance optimization, Data management, Troubleshooting, Data security, Database design, Database configuration, System integration.",big data nosql mongodb db2 mainframe database administration postgresql db2 administration nosql database management,mongodb administration db2 administration mainframe postgresql administration database performance optimization data management troubleshooting data security database design database configuration system integration,Mongo/Postgres/DB2 Database Administrators GSI big data nosql mongodb db2 mainframe database administration postgresql db2 administration nosql database management mongodb administration db2 administration mainframe postgresql administration database performance optimization data management troubleshooting data security database design database configuration system integration
Data Engineer,Tech Mahindra,GSI,"GCP services (BigQuery, Dataflow, Data Composer), Data engineering, Data warehousing, ETL processes, Real-time data processing, Streaming analytics, Data manipulation and analysis, Data pipelines.","SQL, Python, PySpark, Dataflow implementation, BigQuery management, Data Composer usage, Real-time analytics, Problem-solving, Attention to detail, Data processing, Data integration.",gcp services bigquery dataflow data composer data engineering data warehousing etl processes realtime data processing streaming analytics data manipulation analysis data pipelines,sql python pyspark dataflow implementation bigquery management data composer usage realtime analytics problemsolving attention detail data processing data integration,Data Engineer GSI gcp services bigquery dataflow data composer data engineering data warehousing etl processes realtime data processing streaming analytics data manipulation analysis data pipelines sql python pyspark dataflow implementation bigquery management data composer usage realtime analytics problemsolving attention detail data processing data integration
Data Engineer,Tech Mahindra,GSI,"Object-oriented programming, Python, Scala, Data architecture, Semi-structured data (JSON, XML), SQL, Relational databases, Azure Databricks, ADLS, Big data tools (Hadoop, Spark), Stream processing, NoSQL databases, Postgres, Azure cloud services (ADF, Key Vaults, Log Analytics), Stream-processing systems (Spark-Streaming).","Python programming, PySpark, SQL query authoring, Data manipulation (Pandas, NumPy, SciPy), Shell scripting, Linux commands, Data pipeline design, Big data tool implementation, Data integration, Message queuing, Stream processing, Cloud service usage, Data analytics, Problem-solving, Data processing, Scalability.",objectoriented programming python scala data architecture semistructured data json xml sql relational databases azure databricks adls big data tools hadoop spark stream processing nosql databases postgres azure cloud services adf key vaults log analytics streamprocessing systems sparkstreaming,python programming pyspark sql query authoring data manipulation pandas numpy scipy shell scripting linux commands data pipeline design big data tool implementation data integration message queuing stream processing cloud service usage data analytics problemsolving data processing scalability,Data Engineer GSI objectoriented programming python scala data architecture semistructured data json xml sql relational databases azure databricks adls big data tools hadoop spark stream processing nosql databases postgres azure cloud services adf key vaults log analytics streamprocessing systems sparkstreaming python programming pyspark sql query authoring data manipulation pandas numpy scipy shell scripting linux commands data pipeline design big data tool implementation data integration message queuing stream processing cloud service usage data analytics problemsolving data processing scalability
Junior Data Analyst,Cognizant,GSI,"Clinical Data Management, Clinical BPO, Data validation, Quality control processes, Regulatory requirements, Industry standards, Clinical trial processes, Documentation, Data management systems, Software tools in clinical data, Continuous learning.","MS Excel (data analysis and reporting), Attention to detail, Accuracy in data handling, Organizational skills, Time management, Communication (verbal & written), Collaboration, Problem-solving, Process improvement, Independent work, Teamwork, Professional development.",clinical data management clinical bpo data validation quality control processes regulatory requirements industry standards clinical trial processes documentation data management systems software tools clinical data continuous learning,ms excel data analysis reporting attention detail accuracy data handling organizational skills time management communication verbal written collaboration problemsolving process improvement independent work teamwork professional development,Junior Data Analyst GSI clinical data management clinical bpo data validation quality control processes regulatory requirements industry standards clinical trial processes documentation data management systems software tools clinical data continuous learning ms excel data analysis reporting attention detail accuracy data handling organizational skills time management communication verbal written collaboration problemsolving process improvement independent work teamwork professional development
Data Analyst - Sr. Executive,Cognizant,GSI,"Program management, Project delivery, Cross-functional team management, Stakeholder management, Experience design, Project risk management, Hybrid work model, Critical thinking, Continuous improvement.","Proficiency in PowerBI, MS PowerPoint, MS Excel (including Macros), Organizational skills, Time management, Communication (verbal & written), Interpersonal skills, Problem-solving, Attention to detail, Quality focus, Adaptability, Independent work, Team collaboration, Professional development.",program management project delivery crossfunctional team management stakeholder management experience design project risk management hybrid work model critical thinking continuous improvement,proficiency powerbi ms powerpoint ms excel including macros organizational skills time management communication verbal written interpersonal skills problemsolving attention detail quality focus adaptability independent work team collaboration professional development,Data Analyst - Sr. Executive GSI program management project delivery crossfunctional team management stakeholder management experience design project risk management hybrid work model critical thinking continuous improvement proficiency powerbi ms powerpoint ms excel including macros organizational skills time management communication verbal written interpersonal skills problemsolving attention detail quality focus adaptability independent work team collaboration professional development
Senior Process Executive-Data,Cognizant,GSI,"Medical coding, Provider processes, Coding audits, Industry compliance standards, Process improvements, Key performance indicators (KPIs), Medical coding standards and regulations.","MS Excel (data analysis and management), Attention to detail, Accuracy in coding, Communication (verbal & written), Training and mentoring, Report generation, Problem-solving, Process optimization, Time management, Night shift work, Documentation management, Compliance monitoring.",medical coding provider processes coding audits industry compliance standards process improvements key performance indicators kpis medical coding standards regulations,ms excel data analysis management attention detail accuracy coding communication verbal written training mentoring report generation problemsolving process optimization time management night shift work documentation management compliance monitoring,Senior Process Executive-Data GSI medical coding provider processes coding audits industry compliance standards process improvements key performance indicators kpis medical coding standards regulations ms excel data analysis management attention detail accuracy coding communication verbal written training mentoring report generation problemsolving process optimization time management night shift work documentation management compliance monitoring
