job_role,company_name,company_type,knowledge,skills,knowledge_cleaned,skills_cleaned,combined_features
Technical Support Engineering,Microsoft,MAANG/FAAMG,"Experience in technical support, technical consulting, or information technology, system administration, configuration of Windows and Linux operating systems, understanding of Windows and Linux event logs, syslogs, performance analysis using built-in performance counters, patch and security update management for Windows and Linux, network connectivity concepts for private and public networks, knowledge of Windows Active Directory, security, and access control, understanding of cloud computing platforms (Azure, AWS, Google Cloud), and knowledge of databases and query languages.","Experience with automating operating system tasks using scripting languages like Powershell, Python, or similar, experience with web app development in C# or Java, familiarity with ASP.NET, MVC application development or support, knowledge of container solutions like Docker or Kubernetes, ability to retrieve data via query language, proficiency in troubleshooting network connectivity issues, and experience in using cloud computing platforms for infrastructure management.",experience technical support technical consulting information technology system administration configuration windows linux operating systems understanding windows linux event logs syslogs performance analysis using builtin performance counters patch security update management windows linux network connectivity concepts private public networks knowledge windows active directory security access control understanding cloud computing platforms azure aws google cloud knowledge databases query languages,experience automating operating system tasks using scripting languages like powershell python similar experience web app development c java familiarity aspnet mvc application development support knowledge container solutions like docker kubernetes ability retrieve data via query language proficiency troubleshooting network connectivity issues experience using cloud computing platforms infrastructure management,Technical Support Engineering MAANG/FAAMG experience technical support technical consulting information technology system administration configuration windows linux operating systems understanding windows linux event logs syslogs performance analysis using builtin performance counters patch security update management windows linux network connectivity concepts private public networks knowledge windows active directory security access control understanding cloud computing platforms azure aws google cloud knowledge databases query languages experience automating operating system tasks using scripting languages like powershell python similar experience web app development c java familiarity aspnet mvc application development support knowledge container solutions like docker kubernetes ability retrieve data via query language proficiency troubleshooting network connectivity issues experience using cloud computing platforms infrastructure management
Cloud Solution Architect - Infra,Microsoft,MAANG/FAAMG,"Extensive experience in cloud/infrastructure technologies, IT consulting/support, systems administration, network operations, software development/support, technology solutions, practice development, and architecture, with a deep understanding of customer business environments and drivers. Familiarity with leveraging digital signals and modern selling techniques to assess customer needs, define value outcomes, and manage engagements. Experience in building trusted relationships and creating business value aligned with industry outcomes.","Insightful listening with the ability to ask questions that uncover customer needs, situational fluency to adapt conversations based on verbal and non-verbal cues, strong relationship-building skills and trusted advisership, ability to assess and communicate the business value of solutions, leveraging digital signals for customer insights, and a solid understanding of business outcomes and their alignment with technology solutions. Experience working on technical projects and guiding customer engagements to successful outcomes.",extensive experience cloudinfrastructure technologies consultingsupport systems administration network operations software developmentsupport technology solutions practice development architecture deep understanding customer business environments drivers familiarity leveraging digital signals modern selling techniques assess customer needs define value outcomes manage engagements experience building trusted relationships creating business value aligned industry outcomes,insightful listening ability ask questions uncover customer needs situational fluency adapt conversations based verbal nonverbal cues strong relationshipbuilding skills trusted advisership ability assess communicate business value solutions leveraging digital signals customer insights solid understanding business outcomes alignment technology solutions experience working technical projects guiding customer engagements successful outcomes,Cloud Solution Architect - Infra MAANG/FAAMG extensive experience cloudinfrastructure technologies consultingsupport systems administration network operations software developmentsupport technology solutions practice development architecture deep understanding customer business environments drivers familiarity leveraging digital signals modern selling techniques assess customer needs define value outcomes manage engagements experience building trusted relationships creating business value aligned industry outcomes insightful listening ability ask questions uncover customer needs situational fluency adapt conversations based verbal nonverbal cues strong relationshipbuilding skills trusted advisership ability assess communicate business value solutions leveraging digital signals customer insights solid understanding business outcomes alignment technology solutions experience working technical projects guiding customer engagements successful outcomes
Software Engineer II,Microsoft,MAANG/FAAMG,"Solid understanding of Object-Oriented Programming (OOP) and common design patterns, in-depth knowledge of cloud development (Azure, AWS, Google Cloud), experience with DevOps practices, and multithreading and asynchronous processing. Familiarity with CI/CD pipelines, agile practices, and cloud services, particularly in Azure. Understanding of the software development lifecycle, including delivering end-to-end solutions in collaboration with technical partners.","4+ years of software development experience with proficiency in C# (Java or C++), effective communication and collaboration skills, ability to handle ambiguity and prioritize tasks, strong interpersonal skills, and the ability to manage tight deadlines and stakeholder expectations. Strong sense of ownership, self-motivated with excellent organizational skills to deliver results, and ability to ramp up quickly on multiple technologies.",solid understanding objectoriented programming oop common design patterns indepth knowledge cloud development azure aws google cloud experience devops practices multithreading asynchronous processing familiarity cicd pipelines agile practices cloud services particularly azure understanding software development lifecycle including delivering endtoend solutions collaboration technical partners,4 years software development experience proficiency c java c effective communication collaboration skills ability handle ambiguity prioritize tasks strong interpersonal skills ability manage tight deadlines stakeholder expectations strong sense ownership selfmotivated excellent organizational skills deliver results ability ramp quickly multiple technologies,Software Engineer II MAANG/FAAMG solid understanding objectoriented programming oop common design patterns indepth knowledge cloud development azure aws google cloud experience devops practices multithreading asynchronous processing familiarity cicd pipelines agile practices cloud services particularly azure understanding software development lifecycle including delivering endtoend solutions collaboration technical partners 4 years software development experience proficiency c java c effective communication collaboration skills ability handle ambiguity prioritize tasks strong interpersonal skills ability manage tight deadlines stakeholder expectations strong sense ownership selfmotivated excellent organizational skills deliver results ability ramp quickly multiple technologies
Lead Technical Support Consultant,Adobe,GCC,"Strong technical understanding of relevant technologies, including Windows operating systems, Adobe CC products (Web/Design/Photography/DVA.family), Enterprise Deployment, Adobe IT tools (CCP, PRTK, AUSST, RUM), SSO, and Active Directory. Knowledge of Mac OS is also desired.","Excellent interpersonal, oral, and written communication skills with the ability to influence and advocate for customer needs. Strong problem-solving and multitasking abilities, with an aptitude for innovative thinking and prioritizing tasks effectively. Ability to work independently with minimal supervision, adapt to flexible working hours for 24x7 support coverage, and remain calm in sensitive situations. Strong customer relationship and account management skills.",strong technical understanding relevant technologies including windows operating systems adobe cc products webdesignphotographydvafamily enterprise deployment adobe tools ccp prtk ausst rum sso active directory knowledge mac os also desired,excellent interpersonal oral written communication skills ability influence advocate customer needs strong problemsolving multitasking abilities aptitude innovative thinking prioritizing tasks effectively ability work independently minimal supervision adapt flexible working hours 24x7 support coverage remain calm sensitive situations strong customer relationship account management skills,Lead Technical Support Consultant GCC strong technical understanding relevant technologies including windows operating systems adobe cc products webdesignphotographydvafamily enterprise deployment adobe tools ccp prtk ausst rum sso active directory knowledge mac os also desired excellent interpersonal oral written communication skills ability influence advocate customer needs strong problemsolving multitasking abilities aptitude innovative thinking prioritizing tasks effectively ability work independently minimal supervision adapt flexible working hours 24x7 support coverage remain calm sensitive situations strong customer relationship account management skills
Network Engineer,Adobe,GCC,"Enterprise networking (Cisco, Juniper, SD-WAN), routing protocols (BGP, OSPF, MPLS), network management and monitoring, cloud networking (Azure, AWS, GCP), network automation, security process design.","Cisco and Juniper platforms, wireless technologies, network automation (Python, Ansible), packet analysis (Wireshark), network documentation, communication and collaboration, vendor management, incident resolution, network management tools.",enterprise networking cisco juniper sdwan routing protocols bgp ospf mpls network management monitoring cloud networking azure aws gcp network automation security process design,cisco juniper platforms wireless technologies network automation python ansible packet analysis wireshark network documentation communication collaboration vendor management incident resolution network management tools,Network Engineer GCC enterprise networking cisco juniper sdwan routing protocols bgp ospf mpls network management monitoring cloud networking azure aws gcp network automation security process design cisco juniper platforms wireless technologies network automation python ansible packet analysis wireshark network documentation communication collaboration vendor management incident resolution network management tools
Cloud Security,Adobe,GCC,"Cloud security (AWS, Azure), regulatory standards (GDPR, HIPAA, PCI DSS), security assessments, vulnerability scans, security policy development, network security principles, security operations and threats.","Programming (Python, Shell), cloud security services, security policy implementation, communication, and interpersonal skills.",cloud security aws azure regulatory standards gdpr hipaa pci dss security assessments vulnerability scans security policy development network security principles security operations threats,programming python shell cloud security services security policy implementation communication interpersonal skills,Cloud Security GCC cloud security aws azure regulatory standards gdpr hipaa pci dss security assessments vulnerability scans security policy development network security principles security operations threats programming python shell cloud security services security policy implementation communication interpersonal skills
HANA Database Administrator,Intel,GCC,"SAP HANA architecture, administration, upgrades, performance tuning, backup and recovery strategies, security best practices, Linux/UNIX operating systems.","SAP HANA database administration, shell scripting, security implementation, relevant SAP HANA certifications.",sap hana architecture administration upgrades performance tuning backup recovery strategies security best practices linuxunix operating systems,sap hana database administration shell scripting security implementation relevant sap hana certifications,HANA Database Administrator GCC sap hana architecture administration upgrades performance tuning backup recovery strategies security best practices linuxunix operating systems sap hana database administration shell scripting security implementation relevant sap hana certifications
System Software Quality Engineer,Intel,GCC,"Software quality engineering methods, software development life cycle, programming/scripting languages, data analysis, and metrics creation techniques.","Data visualization (PowerBI or equivalent), Robotic Process Automation (RPA), AI agents for automation, delivering software products to market, supporting software development practices.",software quality engineering methods software development life cycle programmingscripting languages data analysis metrics creation techniques,data visualization powerbi equivalent robotic process automation rpa ai agents automation delivering software products market supporting software development practices,System Software Quality Engineer GCC software quality engineering methods software development life cycle programmingscripting languages data analysis metrics creation techniques data visualization powerbi equivalent robotic process automation rpa ai agents automation delivering software products market supporting software development practices
Senior System Debug Engineer,Intel,GCC,"Linux kernel debugging, PCIe, memory, power management (PM), firmware, boot loader, GPU architecture, machine learning frameworks (PyTorch, TensorFlow), AI model deployment and validation, Intel/ARM platform architecture and debug tools.","Expertise in Linux system/user mode programming, shell, Python, C, C++, strong self-learning ability, excellent communication skills.",linux kernel debugging pcie memory power management pm firmware boot loader gpu architecture machine learning frameworks pytorch tensorflow ai model deployment validation intelarm platform architecture debug tools,expertise linux systemuser mode programming shell python c c strong selflearning ability excellent communication skills,Senior System Debug Engineer GCC linux kernel debugging pcie memory power management pm firmware boot loader gpu architecture machine learning frameworks pytorch tensorflow ai model deployment validation intelarm platform architecture debug tools expertise linux systemuser mode programming shell python c c strong selflearning ability excellent communication skills
Technical Support Engineer,Oracle,GCC,"Linux operating systems, SQL (Structured Query Language), application support, troubleshooting techniques.","Experience in Linux and SQL, technical support, troubleshooting.",linux operating systems sql structured query language application support troubleshooting techniques,experience linux sql technical support troubleshooting,Technical Support Engineer GCC linux operating systems sql structured query language application support troubleshooting techniques experience linux sql technical support troubleshooting
System Administrator,Oracle,GCC,"Oracle Database, SQL query execution, Oracle Hospitality product suite (Simphony, Reporting & Analytics), Unix-based systems, Networking, application troubleshooting, monitoring tools (Grafana, Prometheus, APM, OCI Log Explorer), ITIL framework","Application support, problem-solving, communication (verbal & written), production system monitoring, application management services, application performance monitoring, system administration.",oracle database sql query execution oracle hospitality product suite simphony reporting analytics unixbased systems networking application troubleshooting monitoring tools grafana prometheus apm oci log explorer itil framework,application support problemsolving communication verbal written production system monitoring application management services application performance monitoring system administration,System Administrator GCC oracle database sql query execution oracle hospitality product suite simphony reporting analytics unixbased systems networking application troubleshooting monitoring tools grafana prometheus apm oci log explorer itil framework application support problemsolving communication verbal written production system monitoring application management services application performance monitoring system administration
Principal Member of Technical Staff,Oracle,GCC,"Database and Engineered Systems Cloud Platform Services (PaaS, SaaS, Exadata as a Service), Database Administration, DB internals, Security fixes, Virtualization, Networking, Platform Storage Architecture, Exadata Machine administration, Compute, Cell, and switch patching.","Automation (Java, Perl, Python, Shell/Bash), Exadata Database Machine, Exadata Storage Server, DBA skills, RAC, RMAN, troubleshooting, algorithms, data structures, patching, incident resolution.",database engineered systems cloud platform services paas saas exadata service database administration db internals security fixes virtualization networking platform storage architecture exadata machine administration compute cell switch patching,automation java perl python shellbash exadata database machine exadata storage server dba skills rac rman troubleshooting algorithms data structures patching incident resolution,Principal Member of Technical Staff GCC database engineered systems cloud platform services paas saas exadata service database administration db internals security fixes virtualization networking platform storage architecture exadata machine administration compute cell switch patching automation java perl python shellbash exadata database machine exadata storage server dba skills rac rman troubleshooting algorithms data structures patching incident resolution
Linux AI Library Developer,IBM,GCC,"Computer Architecture, Operating Systems, Compilers, Runtimes, low-level debugging and tracing, Open-source development, Git, GitHub.","C/C++ programming, assembly language, developing and maintaining open-source toolchains and libraries, resolving functional issues, working with open-source communities, technical guidance, customer support, proof of concepts.",computer architecture operating systems compilers runtimes lowlevel debugging tracing opensource development git github,cc programming assembly language developing maintaining opensource toolchains libraries resolving functional issues working opensource communities technical guidance customer support proof concepts,Linux AI Library Developer GCC computer architecture operating systems compilers runtimes lowlevel debugging tracing opensource development git github cc programming assembly language developing maintaining opensource toolchains libraries resolving functional issues working opensource communities technical guidance customer support proof concepts
Design Verification Engineer,IBM,GCC,"Computer architecture, multi-processor cache coherency, AXI/AHB/ACE/ACE-lite/CHI/On-chip system fabric interface verification, performance parameters of On-chip coherency transport network designs, functional verification methodologies (UVM/OVM), HDLs (VHDL/Verilog), Linux/Unix environments, Continuous Integration, DevOps workflows.","9+ years of processor/ASIC functional verification, C++/SystemVerilog programming, Python/Perl scripting, test plan development, verification of coherency transport interconnects, stress testing, corner case scenario identification, debugging, testbench development, test scenario writing, verification coverage closure, leadership in verification flow.",computer architecture multiprocessor cache coherency axiahbaceacelitechionchip system fabric interface verification performance parameters onchip coherency transport network designs functional verification methodologies uvmovm hdls vhdlverilog linuxunix environments continuous integration devops workflows,9 years processorasic functional verification csystemverilog programming pythonperl scripting test plan development verification coherency transport interconnects stress testing corner case scenario identification debugging testbench development test scenario writing verification coverage closure leadership verification flow,Design Verification Engineer GCC computer architecture multiprocessor cache coherency axiahbaceacelitechionchip system fabric interface verification performance parameters onchip coherency transport network designs functional verification methodologies uvmovm hdls vhdlverilog linuxunix environments continuous integration devops workflows 9 years processorasic functional verification csystemverilog programming pythonperl scripting test plan development verification coherency transport interconnects stress testing corner case scenario identification debugging testbench development test scenario writing verification coverage closure leadership verification flow
Logic Design Engineer,IBM,GCC,"Microarchitecture, Logic design, VLSI design (VHDL/Verilog), RISC/CISC processor architecture, designer simulations, power-efficient logic design, physical design, assertions, timing, verification coverage.","3-8 years in microarchitecture and logic design, test plan reviews, design closure, Python scripting, effective communication, global team collaboration.",microarchitecture logic design vlsi design vhdlverilog risccisc processor architecture designer simulations powerefficient logic design physical design assertions timing verification coverage,38 years microarchitecture logic design test plan reviews design closure python scripting effective communication global team collaboration,Logic Design Engineer GCC microarchitecture logic design vlsi design vhdlverilog risccisc processor architecture designer simulations powerefficient logic design physical design assertions timing verification coverage 38 years microarchitecture logic design test plan reviews design closure python scripting effective communication global team collaboration
Software Engineer,Cisco,GCC,"Software development, system administration, containerization (Docker, Kubernetes), Pub/Sub frameworks (Apache Kafka), monitoring tools (DataDog, Grafana, Splunk), cloud platforms (AWS, GCP, Azure), Unix/Linux operating systems, CI/CD, release management, DevOps principles, automation tools (Terraform, Jenkins, Ansible, Puppet), data pipeline and workflow management.","Programming (Python, Java, JavaScript), strong problem-solving, experience with Git Flows, Scrum methodology, configuration management, excellent communication, teamwork, eagerness to learn, and adapt in dynamic environments.",software development system administration containerization docker kubernetes pubsub frameworks apache kafka monitoring tools datadog grafana splunk cloud platforms aws gcp azure unixlinux operating systems cicd release management devops principles automation tools terraform jenkins ansible puppet data pipeline workflow management,programming python java javascript strong problemsolving experience git flows scrum methodology configuration management excellent communication teamwork eagerness learn adapt dynamic environments,Software Engineer GCC software development system administration containerization docker kubernetes pubsub frameworks apache kafka monitoring tools datadog grafana splunk cloud platforms aws gcp azure unixlinux operating systems cicd release management devops principles automation tools terraform jenkins ansible puppet data pipeline workflow management programming python java javascript strong problemsolving experience git flows scrum methodology configuration management excellent communication teamwork eagerness learn adapt dynamic environments
